label,content
1,mọi người có thể review cho em về ngành logistics và quản lí chuỗi cung ứng được không ạ
0,mng ơi cho em hỏi nên học ngành ngôn ngữ anh của đại học ngoại ngữ đhqghn và đại học ngoại thương ạ và cho em hỏi sự khác biệt giữa chương trình đào tạo của trường này với ạ em cảm ơn
0,mọi người ơi cho em hỏi là giữa ngôn ngữ nhật ngôn ngữ hàn và ngôn ngữ trung thì nên chọn cái nào vậy ạ tại em nghe nói tiếng nhật học sẽ khó hơn nhưng sau này cơ hội việc làm sẽ nhiều hơn í ạ
0,dạ mọi người ơi giữa đại học ngân hàng ngành tài chính ngân hàng và đại học quốc tế thì em đang phân vân không biết chọn ngành nào ấy ạ
0,các anh chị tư vấn cho em ngành truyền thông với cả ngành quan hệ công chúng thì sẽ học về những cái gì với cả có trường nào ổn về ngành này với ạ em cảm ơn anh chị ạ
1,mọi người review cho em ngành công nghệ thông tin với ạ và khmt và ktmt là gì mình học về gì vậy mọi người
0,anh chị ơi cho em hỏi là nên học kdqt ở tdt hay ktqt ở buh vậy ạ với 2 chuyên ngành này khác nhau nhiều không ạ 
1,cho em hỏi là học quản trị kinh doanh học trường công nghiệp tp hcm có được không ạ
0,cho em hỏi ở đây có anh chị nào học ngôn ngữ và đồng thời học thêm nghành kinh tế không ạ cho em định hướng và hướng đi là em nên làm gì từ bây giờ ạ với lại ngành ngôn ngữ nào sẽ có triển vọng hơn và chuyên ngành kinh tế nào có thể học kết hợp với ngành ngôn ngữ ạ em cảm ơn nhìu
0,mng cho em hỏi học marketing có học nhiều về tiếng anh và đòi hỏi phải giỏi tiếng anh không ạ cho em hỏi là học ngôn ngữ trung thì ra làm marketing đc không ạ hay phải đi đúng ngành học mới đc
0,chào mọi người 1 em muốn thi ngành quản trị kinh doanh nên có thể cho em xin một số trường đào tạo tốt ở tphcm không ạ em đã biết tới ngoại thương và đại học không tế 2 em muốn thi ngành d07 thì ngoài qtkd ra còn ngành nào có cơ hội làm việc tốt không ạ em tốt tiếng anh nên muốn làm việc ở nước ngoài hoặc công ty nước ngoài 3 nếu vẫn là qtkd thì em nên chọn ngành này hay kinh doanh quốc tế ạ em thấy 2 ngành gần như nhau em cảm ơn
1,em dự tính sẽ học ngành logistics supply chain management anh chị nào có kinh nghiệm hoặc hiểu biết về ngành trên có thể tư vấn cho em với ạ 
1,em muốn tìm hiểu về khoa học máy tính ạ em hi vọng các anh chị tư vấn giúp em ạ
0,các anh chị ơiii cho em hỏi em là một đứa sống khá khép kín không giỏi giao tiếp học môn tự nhiên không tốt cho lắm nên em thi ban xã hội nhưng em học tốt môn anh văn liệu em lựa chọn ngành thương mại điện tử có phù hợp không ạ cảm ơn anh chị nhiều ạ
1,em đang phân vân giữa quản trị kinh doanh và marketing anh chị có kinh nghiệm cho em xin tư vấn với ạ
0,học ngành du lịch thì kể cả đại học hay cao đẳng có phải học toán không các anh chị 
0,cho em hỏi kinh tế đối ngoại và quan hệ quốc tế giống và khác nhau như thế nào ạ
1,cho em hỏi ở đây có anh chị nào học ngôn ngữ không ạ cho em định hướng và hướng đi em nên làm gì từ bây giờ
0,marketing clc ufm đào tạo tốt không ạ cho em xin review về học phí và chất lượng đào tạo marketing clc ufm với ạ
1,mọi người cho em nhận xét về ngành ngoại ngữ ạ
1,mọi người cho em hỏi học quản trị kinh doanh quan hệ công chúng có ổn không ạ
0,em đang phân vân giữa 2 ngành quản lý nhà nước và dược ạ
0,mn ơi ngôn ngữ anh ngôn ngữ hàn ngôn ngữ trung cái nào cũng thích hết thì nên chọn cái nào nhất ạ với lại em nghe nói học ngôn ngữ hàn hiện nay có nhiều triển vọng thị trường rộng mở nhiều việc làm hơn nhiều tiền hơn khi học tiếng trung có phải vậy không ạ
1,em đang muốn xin ít review về ngành truyền thông đa phương tiện em cảm ơn
1,em có định hướng học logicstic ở trường đại học tài chính maketing có anh chị nào là sinh viên của trường cùng ngành tư vấn cho em 1 tí được không ạ em cảm ơn nhiều
1,học ngôn ngữ anh ở đại học bà rịa vũng tàu ổn không ạ em xin ý kiến mọi người ạ
0,mọi người cho em hỏi là em đang học lớp 12 và muốn đăng kí đại học hệ vừa học vừa làm cụ thể là ngành tài chính ngân hàng ở buh thì em cần điều kiện gì và cách thức đăng kí hay xét tuyển như thế nào ạ
0,marketing học uel thì ổn không ạ với lại trường có xét học bạ không ạ
1,xin chào anh chị ạ anh chị có thể cho em xin review về ngành thương mại điện tử được không ạ và đầu ra ngành này công việc sao ạ em cảm ơn
0,xin chào mọi ngườig ạ em có nguyện vọng đăng ký trường đại học ngoại ngữ đhqg hà nội ulis mọi ngườig có thể cho em một chút thông tin của trường vì dụ như học phí và môi trường ở đó được không ạ và em cũng không biết cách tính điểm của trường là như nào
0,dạ em xin chào mọi người cho em hỏi em đang phân vân ngành ngôn ngữ nhật nhật bản học nên học trường đại học mở hcm hay huflit ạ với cho em xin thêm vài trường có đào tạo ngành này tốt học phí cỡ 40tr đổ xuống ạ em cảm ơn ạ
0,em học ngôn ngữ trung đang phân vân không biết chọn giữa uef hufi hay văn lang mong mọi người tư vấn giúp em em cám ơn nhiều ạ
0,dạ anh chị cho em hỏi ngành luật kinh tế thì trừ uel ra thì trường nào đào tạo tốt và cho em xin ít review với ạ
1,mọi người review giúp em ngành kinh doanh quốc tế được không ạ
0,mọi người ơi cho em hỏi học kinh doanh quốc tế kinh tế quốc tế ở tp hcm thì nên đặt mục tiêu vào đại học kinh tế luật hay đại học kinh tế ạ
1,cho em hỏi là ngành kinh doanh quốc tế ra trường cơ hội việc làm như thế nào ạ
0,cho em xin review về 2 trường này với ạ và em học quản trị khách sạn thì trường nào tốt hơn ạ
1,em xin review ngôn ngữ hàn với hàn quốc học với ạ mông lung quá ạ
1,có anh chị nào đang học ngành qhcc pr tổ chức sự kiện của trường cao đẳng fpt có thể cho em xin ít thông tin về ngành này cũng như trường này dc không ạ em cảm ơn ạ
0,em là hs lớp 12 ạ cho em hỏi không biết nhiều về lập trình có học được khoa học dữ liệu không ạ
0,ngành quản trị nhà hàng dịch vụ ăn uống học hufi được không ạ
0,anh chị cho em hỏi hiện tại em đang phân vân hai ngành không biết chọn ngành nào anh chị cho em xin ý kiến quan hệ công chúng và truyền thông đa phương tiện ạ cho em xin về trường dạy hai ngành trên ạ em cảm ơn ạ
1,em mong muốn học kinh tế quốc tế không biết anh chị có thể tư vấn cho em được không ạ
0,mấy anh chị ơii cho em xin hỏi ngành y của trường nam cần thơ học ổn không vậy ạ với cả học phí này kia nữa và được xét học bạ không ạ
1,mọi người cho em xin ít review về ngành quan hệ công chúng giữa trường đại học văn lang và đại học kinh chính
1,em lớp 12 em muốn thi về truyền thông đa phương tiện thì nên thi trường nào ạ em muốn xin rì viu của các anh chị
0,các anh chị ơi cho em hỏi nếu học kinh tế quốc tế ở học viện ngoại giao sẽ thiên về ngoại giao và kinh tế còn học ở những trường như neu uef sẽ học sâu và đa dạng về kinh tế quốc tế hơn phải không ạ
1,khoa cntt truyền thông đại học đà nẵng như thế nào ạ mọi người cho em xin ít lời khuyên
